{
  "adapter": "game",
  "approval_constraints": [
    "Blocked approval requires a fresh Stage 3 review bundle before operator approval can proceed."
  ],
  "approval_id": "approval:mission-board:blocked-stale-review",
  "approval_status": "blocked",
  "approval_summary": {
    "approval_scope_summary": "Operator approval is blocked because the captured review fingerprint is stale.",
    "operator_summary": "Blocked pending current review bundle verification.",
    "risk_acknowledgement": "Blocked approval records do not grant execution permission or downstream lifecycle authority."
  },
  "approved_by": "operator",
  "approved_change_ids": [],
  "artifact_type": "game_adapter_stage4_approval",
  "contract_name": "DGCEGameAdapterStage4Approval",
  "contract_version": "dgce.game_adapter.stage4.approval.v1",
  "created_at": "2026-05-05T12:10:00Z",
  "domain": "game_adapter",
  "evidence": [
    {
      "reference": ".dce/review/mission-board.stage3_review.json#stale",
      "source": "review_bundle"
    },
    {
      "reference": "operator_context:stale-review-detected",
      "source": "operator_context"
    }
  ],
  "forbidden_runtime_actions": [
    "no_auto_approval",
    "no_binary_blueprint_parsing",
    "no_blueprint_mutation",
    "no_execution_performed",
    "no_execution_permission_granted",
    "no_guardrail_policy_decision",
    "no_stage6_gate_decision",
    "no_stage7_alignment_result",
    "no_stage75_simulation_result",
    "no_stage8_execution_stamp",
    "no_unreal_project_writes",
    "no_write_directives"
  ],
  "rejected_change_ids": [],
  "section_id": "mission-board",
  "source_input_fingerprint": "3333333333333333333333333333333333333333333333333333333333333333",
  "source_preview_fingerprint": "2222222222222222222222222222222222222222222222222222222222222222",
  "source_review_fingerprint": "aaaaaaaaaaaaaaaaaaaaaaaaaaaaaaaaaaaaaaaaaaaaaaaaaaaaaaaaaaaaaaaa",
  "source_review_id": "review:mission-board:stage3",
  "stale_detection": {
    "captured_input_fingerprint": "3333333333333333333333333333333333333333333333333333333333333333",
    "captured_preview_fingerprint": "2222222222222222222222222222222222222222222222222222222222222222",
    "captured_review_fingerprint": "aaaaaaaaaaaaaaaaaaaaaaaaaaaaaaaaaaaaaaaaaaaaaaaaaaaaaaaaaaaaaaaa",
    "stale_check_required": true
  }
}
